{
  "manifestId": "RR-EXM-ae810629ffb4",
  "manifestKey": "ae810629ffb432fb6a10a554fd190aebf29d526da273afd5539ab10fc4aaf8c4",
  "manifestHash": "0205f8bbf47dce20a9acdce9eb44e5f06b85faa3a907640ba89d977954885dc6",
  "createdAt": "2026-09-03T00:00:00.000Z",
  "schemaVersion": 1,
  "kind": "execution-manifest",
  "reviewRunId": "2026-09-03T00-00-00-000Z-def456",
  "riverReview": {
    "status": "resolved",
    "version": "1.91.0"
  },
  "plugin": {
    "status": "resolved",
    "host": "claude-code",
    "pluginVersion": "1.91.0"
  },
  "flow": {
    "status": "missing",
    "id": null,
    "version": null,
    "sha256": null
  },
  "agents": {
    "status": "missing",
    "entries": []
  },
  "skills": {
    "status": "missing",
    "entries": [
      {
        "id": "requirements-consistency",
        "version": "1",
        "sha256": null
      }
    ],
    "skillSetHash": "58f333b61f0dffcaacbd1ed1d7f845346a2e15fdef2270c26a7700db3941ceb2"
  },
  "artifacts": {
    "status": "missing",
    "entries": []
  },
  "policy": {
    "status": "missing",
    "ref": null,
    "sha256": null,
    "riskMapDigest": "0123456789abcdef"
  },
  "runtime": {
    "status": "resolved",
    "provider": "anthropic",
    "model": "claude-sonnet-4",
    "profile": null
  },
  "config": {
    "status": "missing",
    "sha256": null
  },
  "writeEffects": [],
  "redaction": {
    "applied": true,
    "appliedPatterns": [
      "githubToken",
      "openaiKey",
      "anthropicKey",
      "googleApiKey",
      "awsAccessKey",
      "privateKey",
      "bearerToken",
      "databaseUrl",
      "webhookUrl",
      "urlUserInfo",
      "awsSecretKey",
      "oauthSecret",
      "passwordAssignment",
      "envAssignment",
      "highEntropy"
    ],
    "hits": []
  }
}
