{
  "manifestId": "RR-EXM-b2e05025f7c5",
  "manifestKey": "b2e05025f7c51248b0683f48f1c4bb24a198b7add6dc832df92a7cad545daa23",
  "manifestHash": "4e22f8233ae34e371386c6417e6429d23fc401633b6f6c366ca4f1616ab981ec",
  "createdAt": "2026-09-03T00:00:00.000Z",
  "schemaVersion": 1,
  "kind": "execution-manifest",
  "reviewRunId": "2026-09-03T00-00-00-000Z-abc123",
  "riverReview": {
    "status": "resolved",
    "version": "1.91.0"
  },
  "plugin": {
    "status": "resolved",
    "host": "claude-code",
    "pluginVersion": "1.91.0"
  },
  "flow": {
    "status": "resolved",
    "id": "final-review",
    "version": "1",
    "sha256": "aaaaaaaaaaaaaaaaaaaaaaaaaaaaaaaaaaaaaaaaaaaaaaaaaaaaaaaaaaaaaaaa"
  },
  "agents": {
    "status": "resolved",
    "entries": [
      {
        "id": "completion-judge",
        "version": "1",
        "sha256": "bbbbbbbbbbbbbbbbbbbbbbbbbbbbbbbbbbbbbbbbbbbbbbbbbbbbbbbbbbbbbbbb"
      },
      {
        "id": "finding-verifier",
        "version": "1",
        "sha256": "cccccccccccccccccccccccccccccccccccccccccccccccccccccccccccccccc"
      }
    ]
  },
  "skills": {
    "status": "resolved",
    "entries": [
      {
        "id": "a11y-accessible-name",
        "version": "2",
        "sha256": "eeeeeeeeeeeeeeeeeeeeeeeeeeeeeeeeeeeeeeeeeeeeeeeeeeeeeeeeeeeeeeee"
      },
      {
        "id": "requirements-consistency",
        "version": "1",
        "sha256": "dddddddddddddddddddddddddddddddddddddddddddddddddddddddddddddddd"
      }
    ],
    "skillSetHash": "5e941a48d8e4b956c0df3b2c727842d133950fa55c162954bd4454393335919d"
  },
  "artifacts": {
    "status": "resolved",
    "entries": [
      {
        "name": "diff",
        "sha256": "0000000000000000000000000000000000000000000000000000000000000000"
      },
      {
        "name": "requirements",
        "sha256": "ffffffffffffffffffffffffffffffffffffffffffffffffffffffffffffffff"
      }
    ]
  },
  "policy": {
    "status": "resolved",
    "ref": "pages/reference/review-policy.md",
    "sha256": "1111111111111111111111111111111111111111111111111111111111111111",
    "riskMapDigest": "0123456789abcdef"
  },
  "runtime": {
    "status": "resolved",
    "provider": "anthropic",
    "model": "claude-sonnet-4",
    "profile": "medium"
  },
  "config": {
    "status": "resolved",
    "sha256": "2222222222222222222222222222222222222222222222222222222222222222"
  },
  "writeEffects": [],
  "redaction": {
    "applied": true,
    "appliedPatterns": [
      "githubToken",
      "openaiKey",
      "anthropicKey",
      "googleApiKey",
      "awsAccessKey",
      "privateKey",
      "bearerToken",
      "databaseUrl",
      "webhookUrl",
      "urlUserInfo",
      "awsSecretKey",
      "oauthSecret",
      "passwordAssignment",
      "envAssignment",
      "highEntropy"
    ],
    "hits": []
  }
}
